proverb_text,language,culture_region,theme_tag,time_period,source_maturity
"A stitch in time saves nine.",English,Western Europe,Haste,Modern,2
"kto rano wstaje, temu Pan bóg daje",Polish,Eastern Europe,Perseverance,Ancient,1
"nie dospać trzeba, kto chce dostać chleba",Polish,Eastern Europe,Perseverance,Ancient,1
"кто рано встаёт, тому Бог подаёт",Russian,Eastern Europe,Perseverance,Ancient,1
"kto chce żyć z swojej pracy, dolegać nie trzeba",Polish,Eastern Europe,Perseverance,Ancient,1
"笨人先起身，笨鸟早出林。",Chinese,Eastern Asia,Perseverance,Ancient,1
"巧妇难为无米之炊。",Chinese,Eastern Asia,Resourcefulness,Ancient,1
